{
  "id": "visma",
  "name": "Visma",
  "industry": "productivity-tools",
  "resources": [
    {
      "id": "software-quality-engineering-in-visma-wi-f26efa97",
      "title": "Software Quality Engineering in Visma with Mili Orucevic",
      "url": "https://www.youtube.com/watch?v=MY5_q8bkvX4",
      "type": "video",
      "topics": [
        "quality-engineering"
      ]
    },
    {
      "id": "ra-md-idris-40292b44",
      "title": "RA MD IDRIS ",
      "url": "https://www.facebook.com/ra.md.idris.2025?mibextid=ZbWKwL",
      "type": "blog or article",
      "topics": [
        "android"
      ],
      "addedDate": "2026-07-31"
    }
  ],
  "meta": {
    "totalResources": 1,
    "contributors": [
      "abhivaikar"
    ]
  }
}